"No.","Time","Source","Destination","Protocol","Length","Info"
"1","0.000000","127.0.0.1","127.0.0.1","TCP","56","51702  >  12000 [SYN] Seq=0 Win=65535 Len=0 MSS=65495 WS=256 SACK_PERM=1"
"2","0.000071","127.0.0.1","127.0.0.1","TCP","56","12000  >  51702 [SYN, ACK] Seq=0 Ack=1 Win=65535 Len=0 MSS=65495 WS=256 SACK_PERM=1"
"3","0.000137","127.0.0.1","127.0.0.1","TCP","44","51702  >  12000 [ACK] Seq=1 Ack=1 Win=2619648 Len=0"
"4","0.000171","127.0.0.1","127.0.0.1","TCP","69","51702  >  12000 [PSH, ACK] Seq=1 Ack=1 Win=2619648 Len=25"
"5","0.000207","127.0.0.1","127.0.0.1","TCP","44","12000  >  51702 [ACK] Seq=1 Ack=26 Win=2619648 Len=0"
"6","0.000765","127.0.0.1","127.0.0.1","TCP","69","12000  >  51702 [PSH, ACK] Seq=1 Ack=26 Win=2619648 Len=25"
"7","0.000805","127.0.0.1","127.0.0.1","TCP","44","51702  >  12000 [ACK] Seq=26 Ack=26 Win=2619648 Len=0"
"8","0.001075","127.0.0.1","127.0.0.1","TCP","74","51702  >  12000 [PSH, ACK] Seq=26 Ack=26 Win=2619648 Len=30"
"9","0.001109","127.0.0.1","127.0.0.1","TCP","44","12000  >  51702 [ACK] Seq=26 Ack=56 Win=2619648 Len=0"
"10","0.001424","127.0.0.1","127.0.0.1","TCP","44","51702  >  12000 [FIN, ACK] Seq=56 Ack=26 Win=2619648 Len=0"
"11","0.001462","127.0.0.1","127.0.0.1","TCP","44","12000  >  51702 [ACK] Seq=26 Ack=57 Win=2619648 Len=0"
"12","10.007021","127.0.0.1","127.0.0.1","TCP","56","51703  >  12000 [SYN] Seq=0 Win=65535 Len=0 MSS=65495 WS=256 SACK_PERM=1"
"13","10.007120","127.0.0.1","127.0.0.1","TCP","56","12000  >  51703 [SYN, ACK] Seq=0 Ack=1 Win=65535 Len=0 MSS=65495 WS=256 SACK_PERM=1"
"14","10.007189","127.0.0.1","127.0.0.1","TCP","44","51703  >  12000 [ACK] Seq=1 Ack=1 Win=2619648 Len=0"
"15","10.007217","127.0.0.1","127.0.0.1","TCP","54","51703  >  12000 [PSH, ACK] Seq=1 Ack=1 Win=2619648 Len=10"
"16","10.007240","127.0.0.1","127.0.0.1","TCP","44","12000  >  51703 [ACK] Seq=1 Ack=11 Win=2619648 Len=0"
"17","10.007423","127.0.0.1","127.0.0.1","TCP","44","12000  >  51702 [FIN, ACK] Seq=26 Ack=57 Win=2619648 Len=0"
"18","10.007462","127.0.0.1","127.0.0.1","TCP","44","51702  >  12000 [ACK] Seq=57 Ack=27 Win=2619648 Len=0"
"19","10.008430","127.0.0.1","127.0.0.1","TCP","54","12000  >  51703 [PSH, ACK] Seq=1 Ack=11 Win=2619648 Len=10"
"20","10.008474","127.0.0.1","127.0.0.1","TCP","44","51703  >  12000 [ACK] Seq=11 Ack=11 Win=2619648 Len=0"
"21","10.009017","127.0.0.1","127.0.0.1","TCP","59","51703  >  12000 [PSH, ACK] Seq=11 Ack=11 Win=2619648 Len=15"
"22","10.009058","127.0.0.1","127.0.0.1","TCP","44","12000  >  51703 [ACK] Seq=11 Ack=26 Win=2619648 Len=0"
"23","10.009703","127.0.0.1","127.0.0.1","TCP","44","51703  >  12000 [FIN, ACK] Seq=26 Ack=11 Win=2619648 Len=0"
"24","10.009741","127.0.0.1","127.0.0.1","TCP","44","12000  >  51703 [ACK] Seq=11 Ack=27 Win=2619648 Len=0"
"25","20.069227","127.0.0.1","127.0.0.1","TCP","56","51704  >  12000 [SYN] Seq=0 Win=65535 Len=0 MSS=65495 WS=256 SACK_PERM=1"
"26","20.069320","127.0.0.1","127.0.0.1","TCP","56","12000  >  51704 [SYN, ACK] Seq=0 Ack=1 Win=65535 Len=0 MSS=65495 WS=256 SACK_PERM=1"
"27","20.069371","127.0.0.1","127.0.0.1","TCP","44","51704  >  12000 [ACK] Seq=1 Ack=1 Win=2619648 Len=0"
"28","20.069398","127.0.0.1","127.0.0.1","TCP","69","51704  >  12000 [PSH, ACK] Seq=1 Ack=1 Win=2619648 Len=25"
"29","20.069424","127.0.0.1","127.0.0.1","TCP","44","12000  >  51704 [ACK] Seq=1 Ack=26 Win=2619648 Len=0"
"30","20.069582","127.0.0.1","127.0.0.1","TCP","44","12000  >  51703 [FIN, ACK] Seq=11 Ack=27 Win=2619648 Len=0"
"31","20.069620","127.0.0.1","127.0.0.1","TCP","44","51703  >  12000 [ACK] Seq=27 Ack=12 Win=2619648 Len=0"
"32","20.070572","127.0.0.1","127.0.0.1","TCP","69","12000  >  51704 [PSH, ACK] Seq=1 Ack=26 Win=2619648 Len=25"
"33","20.070619","127.0.0.1","127.0.0.1","TCP","44","51704  >  12000 [ACK] Seq=26 Ack=26 Win=2619648 Len=0"
"34","20.071321","127.0.0.1","127.0.0.1","TCP","74","51704  >  12000 [PSH, ACK] Seq=26 Ack=26 Win=2619648 Len=30"
"35","20.071365","127.0.0.1","127.0.0.1","TCP","44","12000  >  51704 [ACK] Seq=26 Ack=56 Win=2619648 Len=0"
"36","20.071866","127.0.0.1","127.0.0.1","TCP","44","51704  >  12000 [FIN, ACK] Seq=56 Ack=26 Win=2619648 Len=0"
"37","20.071905","127.0.0.1","127.0.0.1","TCP","44","12000  >  51704 [ACK] Seq=26 Ack=57 Win=2619648 Len=0"
"38","30.104320","127.0.0.1","127.0.0.1","TCP","56","51705  >  12000 [SYN] Seq=0 Win=65535 Len=0 MSS=65495 WS=256 SACK_PERM=1"
"39","30.104410","127.0.0.1","127.0.0.1","TCP","56","12000  >  51705 [SYN, ACK] Seq=0 Ack=1 Win=65535 Len=0 MSS=65495 WS=256 SACK_PERM=1"
"40","30.104463","127.0.0.1","127.0.0.1","TCP","44","51705  >  12000 [ACK] Seq=1 Ack=1 Win=2619648 Len=0"
"41","30.104519","127.0.0.1","127.0.0.1","TCP","61","51705  >  12000 [PSH, ACK] Seq=1 Ack=1 Win=2619648 Len=17"
"42","30.104540","127.0.0.1","127.0.0.1","TCP","44","12000  >  51705 [ACK] Seq=1 Ack=18 Win=2619648 Len=0"
"43","30.104698","127.0.0.1","127.0.0.1","TCP","44","12000  >  51704 [FIN, ACK] Seq=26 Ack=57 Win=2619648 Len=0"
"44","30.104737","127.0.0.1","127.0.0.1","TCP","44","51704  >  12000 [ACK] Seq=57 Ack=27 Win=2619648 Len=0"
"45","30.105750","127.0.0.1","127.0.0.1","TCP","61","12000  >  51705 [PSH, ACK] Seq=1 Ack=18 Win=2619648 Len=17"
"46","30.105790","127.0.0.1","127.0.0.1","TCP","44","51705  >  12000 [ACK] Seq=18 Ack=18 Win=2619648 Len=0"
"47","30.106507","127.0.0.1","127.0.0.1","TCP","66","51705  >  12000 [PSH, ACK] Seq=18 Ack=18 Win=2619648 Len=22"
"48","30.106548","127.0.0.1","127.0.0.1","TCP","44","12000  >  51705 [ACK] Seq=18 Ack=40 Win=2619648 Len=0"
"49","30.107043","127.0.0.1","127.0.0.1","TCP","44","51705  >  12000 [FIN, ACK] Seq=40 Ack=18 Win=2619648 Len=0"
"50","30.107085","127.0.0.1","127.0.0.1","TCP","44","12000  >  51705 [ACK] Seq=18 Ack=41 Win=2619648 Len=0"
"51","40.139200","127.0.0.1","127.0.0.1","TCP","56","51706  >  12000 [SYN] Seq=0 Win=65535 Len=0 MSS=65495 WS=256 SACK_PERM=1"
"52","40.139295","127.0.0.1","127.0.0.1","TCP","56","12000  >  51706 [SYN, ACK] Seq=0 Ack=1 Win=65535 Len=0 MSS=65495 WS=256 SACK_PERM=1"
"53","40.139351","127.0.0.1","127.0.0.1","TCP","44","51706  >  12000 [ACK] Seq=1 Ack=1 Win=2619648 Len=0"
"54","40.139406","127.0.0.1","127.0.0.1","TCP","64","51706  >  12000 [PSH, ACK] Seq=1 Ack=1 Win=2619648 Len=20"
"55","40.139427","127.0.0.1","127.0.0.1","TCP","44","12000  >  51706 [ACK] Seq=1 Ack=21 Win=2619648 Len=0"
"56","40.139567","127.0.0.1","127.0.0.1","TCP","44","12000  >  51705 [FIN, ACK] Seq=18 Ack=41 Win=2619648 Len=0"
"57","40.139606","127.0.0.1","127.0.0.1","TCP","44","51705  >  12000 [ACK] Seq=41 Ack=19 Win=2619648 Len=0"
"58","40.140761","127.0.0.1","127.0.0.1","TCP","64","12000  >  51706 [PSH, ACK] Seq=1 Ack=21 Win=2619648 Len=20"
"59","40.140805","127.0.0.1","127.0.0.1","TCP","44","51706  >  12000 [ACK] Seq=21 Ack=21 Win=2619648 Len=0"
"60","40.141515","127.0.0.1","127.0.0.1","TCP","69","51706  >  12000 [PSH, ACK] Seq=21 Ack=21 Win=2619648 Len=25"
"61","40.141558","127.0.0.1","127.0.0.1","TCP","44","12000  >  51706 [ACK] Seq=21 Ack=46 Win=2619648 Len=0"
"62","40.142038","127.0.0.1","127.0.0.1","TCP","44","51706  >  12000 [FIN, ACK] Seq=46 Ack=21 Win=2619648 Len=0"
"63","40.142078","127.0.0.1","127.0.0.1","TCP","44","12000  >  51706 [ACK] Seq=21 Ack=47 Win=2619648 Len=0"
"64","50.210308","127.0.0.1","127.0.0.1","TCP","56","51707  >  12000 [SYN] Seq=0 Win=65535 Len=0 MSS=65495 WS=256 SACK_PERM=1"
"65","50.210381","127.0.0.1","127.0.0.1","TCP","56","12000  >  51707 [SYN, ACK] Seq=0 Ack=1 Win=65535 Len=0 MSS=65495 WS=256 SACK_PERM=1"
"66","50.210427","127.0.0.1","127.0.0.1","TCP","44","51707  >  12000 [ACK] Seq=1 Ack=1 Win=2619648 Len=0"
"67","50.210463","127.0.0.1","127.0.0.1","TCP","62","51707  >  12000 [PSH, ACK] Seq=1 Ack=1 Win=2619648 Len=18"
"68","50.210497","127.0.0.1","127.0.0.1","TCP","44","12000  >  51707 [ACK] Seq=1 Ack=19 Win=2619648 Len=0"
"69","50.210648","127.0.0.1","127.0.0.1","TCP","44","12000  >  51706 [FIN, ACK] Seq=21 Ack=47 Win=2619648 Len=0"
"70","50.210687","127.0.0.1","127.0.0.1","TCP","44","51706  >  12000 [ACK] Seq=47 Ack=22 Win=2619648 Len=0"
"71","50.211679","127.0.0.1","127.0.0.1","TCP","62","12000  >  51707 [PSH, ACK] Seq=1 Ack=19 Win=2619648 Len=18"
"72","50.211719","127.0.0.1","127.0.0.1","TCP","44","51707  >  12000 [ACK] Seq=19 Ack=19 Win=2619648 Len=0"
"73","50.212380","127.0.0.1","127.0.0.1","TCP","67","51707  >  12000 [PSH, ACK] Seq=19 Ack=19 Win=2619648 Len=23"
"74","50.212417","127.0.0.1","127.0.0.1","TCP","44","12000  >  51707 [ACK] Seq=19 Ack=42 Win=2619648 Len=0"
"75","50.213024","127.0.0.1","127.0.0.1","TCP","44","51707  >  12000 [FIN, ACK] Seq=42 Ack=19 Win=2619648 Len=0"
"76","50.213072","127.0.0.1","127.0.0.1","TCP","44","12000  >  51707 [ACK] Seq=19 Ack=43 Win=2619648 Len=0"
"77","60.312826","127.0.0.1","127.0.0.1","TCP","56","51708  >  12000 [SYN] Seq=0 Win=65535 Len=0 MSS=65495 WS=256 SACK_PERM=1"
"78","60.312929","127.0.0.1","127.0.0.1","TCP","56","12000  >  51708 [SYN, ACK] Seq=0 Ack=1 Win=65535 Len=0 MSS=65495 WS=256 SACK_PERM=1"
"79","60.313007","127.0.0.1","127.0.0.1","TCP","44","51708  >  12000 [ACK] Seq=1 Ack=1 Win=2619648 Len=0"
"80","60.313033","127.0.0.1","127.0.0.1","TCP","63","51708  >  12000 [PSH, ACK] Seq=1 Ack=1 Win=2619648 Len=19"
"81","60.313068","127.0.0.1","127.0.0.1","TCP","44","12000  >  51708 [ACK] Seq=1 Ack=20 Win=2619648 Len=0"
"82","60.313213","127.0.0.1","127.0.0.1","TCP","44","12000  >  51707 [FIN, ACK] Seq=19 Ack=43 Win=2619648 Len=0"
"83","60.313251","127.0.0.1","127.0.0.1","TCP","44","51707  >  12000 [ACK] Seq=43 Ack=20 Win=2619648 Len=0"
"84","60.314343","127.0.0.1","127.0.0.1","TCP","63","12000  >  51708 [PSH, ACK] Seq=1 Ack=20 Win=2619648 Len=19"
"85","60.314385","127.0.0.1","127.0.0.1","TCP","44","51708  >  12000 [ACK] Seq=20 Ack=20 Win=2619648 Len=0"
"86","60.315398","127.0.0.1","127.0.0.1","TCP","68","51708  >  12000 [PSH, ACK] Seq=20 Ack=20 Win=2619648 Len=24"
"87","60.315437","127.0.0.1","127.0.0.1","TCP","44","12000  >  51708 [ACK] Seq=20 Ack=44 Win=2619648 Len=0"
"88","60.316048","127.0.0.1","127.0.0.1","TCP","44","51708  >  12000 [FIN, ACK] Seq=44 Ack=20 Win=2619648 Len=0"
"89","60.316085","127.0.0.1","127.0.0.1","TCP","44","12000  >  51708 [ACK] Seq=20 Ack=45 Win=2619648 Len=0"
"90","70.351336","127.0.0.1","127.0.0.1","TCP","56","51709  >  12000 [SYN] Seq=0 Win=65535 Len=0 MSS=65495 WS=256 SACK_PERM=1"
"91","70.351413","127.0.0.1","127.0.0.1","TCP","56","12000  >  51709 [SYN, ACK] Seq=0 Ack=1 Win=65535 Len=0 MSS=65495 WS=256 SACK_PERM=1"
"92","70.351474","127.0.0.1","127.0.0.1","TCP","44","51709  >  12000 [ACK] Seq=1 Ack=1 Win=2619648 Len=0"
"93","70.351500","127.0.0.1","127.0.0.1","TCP","55","51709  >  12000 [PSH, ACK] Seq=1 Ack=1 Win=2619648 Len=11"
"94","70.351531","127.0.0.1","127.0.0.1","TCP","44","12000  >  51709 [ACK] Seq=1 Ack=12 Win=2619648 Len=0"
"95","70.351679","127.0.0.1","127.0.0.1","TCP","44","12000  >  51708 [FIN, ACK] Seq=20 Ack=45 Win=2619648 Len=0"
"96","70.351717","127.0.0.1","127.0.0.1","TCP","44","51708  >  12000 [ACK] Seq=45 Ack=21 Win=2619648 Len=0"
"97","70.352656","127.0.0.1","127.0.0.1","TCP","55","12000  >  51709 [PSH, ACK] Seq=1 Ack=12 Win=2619648 Len=11"
"98","70.352698","127.0.0.1","127.0.0.1","TCP","44","51709  >  12000 [ACK] Seq=12 Ack=12 Win=2619648 Len=0"
"99","70.353456","127.0.0.1","127.0.0.1","TCP","60","51709  >  12000 [PSH, ACK] Seq=12 Ack=12 Win=2619648 Len=16"
"100","70.353503","127.0.0.1","127.0.0.1","TCP","44","12000  >  51709 [ACK] Seq=12 Ack=28 Win=2619648 Len=0"
"101","70.354150","127.0.0.1","127.0.0.1","TCP","44","51709  >  12000 [FIN, ACK] Seq=28 Ack=12 Win=2619648 Len=0"
"102","70.354197","127.0.0.1","127.0.0.1","TCP","44","12000  >  51709 [ACK] Seq=12 Ack=29 Win=2619648 Len=0"
"103","80.398306","127.0.0.1","127.0.0.1","TCP","56","51710  >  12000 [SYN] Seq=0 Win=65535 Len=0 MSS=65495 WS=256 SACK_PERM=1"
"104","80.398401","127.0.0.1","127.0.0.1","TCP","56","12000  >  51710 [SYN, ACK] Seq=0 Ack=1 Win=65535 Len=0 MSS=65495 WS=256 SACK_PERM=1"
"105","80.398471","127.0.0.1","127.0.0.1","TCP","44","51710  >  12000 [ACK] Seq=1 Ack=1 Win=2619648 Len=0"
"106","80.398498","127.0.0.1","127.0.0.1","TCP","49","51710  >  12000 [PSH, ACK] Seq=1 Ack=1 Win=2619648 Len=5"
"107","80.398524","127.0.0.1","127.0.0.1","TCP","44","12000  >  51710 [ACK] Seq=1 Ack=6 Win=2619648 Len=0"
"108","80.398680","127.0.0.1","127.0.0.1","TCP","44","12000  >  51709 [FIN, ACK] Seq=12 Ack=29 Win=2619648 Len=0"
"109","80.398718","127.0.0.1","127.0.0.1","TCP","44","51709  >  12000 [ACK] Seq=29 Ack=13 Win=2619648 Len=0"
"110","80.399626","127.0.0.1","127.0.0.1","TCP","47","12000  >  51710 [PSH, ACK] Seq=1 Ack=6 Win=2619648 Len=3"
"111","80.399674","127.0.0.1","127.0.0.1","TCP","44","51710  >  12000 [ACK] Seq=6 Ack=4 Win=2619648 Len=0"
"112","80.400186","127.0.0.1","127.0.0.1","TCP","52","51710  >  12000 [PSH, ACK] Seq=6 Ack=4 Win=2619648 Len=8[Malformed Packet]"
"113","80.400231","127.0.0.1","127.0.0.1","TCP","44","12000  >  51710 [ACK] Seq=4 Ack=14 Win=2619648 Len=0"
"114","80.400952","127.0.0.1","127.0.0.1","TCP","44","51710  >  12000 [FIN, ACK] Seq=14 Ack=4 Win=2619648 Len=0"
"115","80.400998","127.0.0.1","127.0.0.1","TCP","44","12000  >  51710 [ACK] Seq=4 Ack=15 Win=2619648 Len=0"
"116","90.468127","127.0.0.1","127.0.0.1","TCP","56","51711  >  12000 [SYN] Seq=0 Win=65535 Len=0 MSS=65495 WS=256 SACK_PERM=1"
"117","90.468199","127.0.0.1","127.0.0.1","TCP","56","12000  >  51711 [SYN, ACK] Seq=0 Ack=1 Win=65535 Len=0 MSS=65495 WS=256 SACK_PERM=1"
"118","90.468245","127.0.0.1","127.0.0.1","TCP","44","51711  >  12000 [ACK] Seq=1 Ack=1 Win=2619648 Len=0"
"119","90.468301","127.0.0.1","127.0.0.1","TCP","54","51711  >  12000 [PSH, ACK] Seq=1 Ack=1 Win=2619648 Len=10"
"120","90.468322","127.0.0.1","127.0.0.1","TCP","44","12000  >  51711 [ACK] Seq=1 Ack=11 Win=2619648 Len=0"
"121","90.468482","127.0.0.1","127.0.0.1","TCP","44","12000  >  51710 [FIN, ACK] Seq=4 Ack=15 Win=2619648 Len=0"
"122","90.468521","127.0.0.1","127.0.0.1","TCP","44","51710  >  12000 [ACK] Seq=15 Ack=5 Win=2619648 Len=0"
"123","90.469472","127.0.0.1","127.0.0.1","TCP","54","12000  >  51711 [PSH, ACK] Seq=1 Ack=11 Win=2619648 Len=10"
"124","90.469512","127.0.0.1","127.0.0.1","TCP","44","51711  >  12000 [ACK] Seq=11 Ack=11 Win=2619648 Len=0"
"125","90.470258","127.0.0.1","127.0.0.1","TCP","59","51711  >  12000 [PSH, ACK] Seq=11 Ack=11 Win=2619648 Len=15"
"126","90.470299","127.0.0.1","127.0.0.1","TCP","44","12000  >  51711 [ACK] Seq=11 Ack=26 Win=2619648 Len=0"
"127","90.470850","127.0.0.1","127.0.0.1","TCP","44","51711  >  12000 [FIN, ACK] Seq=26 Ack=11 Win=2619648 Len=0"
"128","90.470886","127.0.0.1","127.0.0.1","TCP","44","12000  >  51711 [ACK] Seq=11 Ack=27 Win=2619648 Len=0"
"129","100.516125","127.0.0.1","127.0.0.1","TCP","56","51712  >  12000 [SYN] Seq=0 Win=65535 Len=0 MSS=65495 WS=256 SACK_PERM=1"
"130","100.516196","127.0.0.1","127.0.0.1","TCP","56","12000  >  51712 [SYN, ACK] Seq=0 Ack=1 Win=65535 Len=0 MSS=65495 WS=256 SACK_PERM=1"
"131","100.516241","127.0.0.1","127.0.0.1","TCP","44","51712  >  12000 [ACK] Seq=1 Ack=1 Win=2619648 Len=0"
"132","100.516279","127.0.0.1","127.0.0.1","TCP","51","51712  >  12000 [PSH, ACK] Seq=1 Ack=1 Win=2619648 Len=7"
"133","100.516299","127.0.0.1","127.0.0.1","TCP","44","12000  >  51712 [ACK] Seq=1 Ack=8 Win=2619648 Len=0"
"134","100.516458","127.0.0.1","127.0.0.1","TCP","44","12000  >  51711 [FIN, ACK] Seq=11 Ack=27 Win=2619648 Len=0"
"135","100.516498","127.0.0.1","127.0.0.1","TCP","44","51711  >  12000 [ACK] Seq=27 Ack=12 Win=2619648 Len=0"
"136","100.517447","127.0.0.1","127.0.0.1","TCP","47","12000  >  51712 [PSH, ACK] Seq=1 Ack=8 Win=2619648 Len=3"
"137","100.517487","127.0.0.1","127.0.0.1","TCP","44","51712  >  12000 [ACK] Seq=8 Ack=4 Win=2619648 Len=0"
"138","100.518055","127.0.0.1","127.0.0.1","TCP","52","51712  >  12000 [PSH, ACK] Seq=8 Ack=4 Win=2619648 Len=8[Malformed Packet]"
"139","100.518104","127.0.0.1","127.0.0.1","TCP","44","12000  >  51712 [ACK] Seq=4 Ack=16 Win=2619648 Len=0"
"140","100.518826","127.0.0.1","127.0.0.1","TCP","44","51712  >  12000 [FIN, ACK] Seq=16 Ack=4 Win=2619648 Len=0"
"141","100.518873","127.0.0.1","127.0.0.1","TCP","44","12000  >  51712 [ACK] Seq=4 Ack=17 Win=2619648 Len=0"
"150","110.544092","127.0.0.1","127.0.0.1","TCP","56","51713  >  12000 [SYN] Seq=0 Win=65535 Len=0 MSS=65495 WS=256 SACK_PERM=1"
"151","110.544171","127.0.0.1","127.0.0.1","TCP","56","12000  >  51713 [SYN, ACK] Seq=0 Ack=1 Win=65535 Len=0 MSS=65495 WS=256 SACK_PERM=1"
"152","110.544232","127.0.0.1","127.0.0.1","TCP","44","51713  >  12000 [ACK] Seq=1 Ack=1 Win=2619648 Len=0"
"153","110.544272","127.0.0.1","127.0.0.1","TCP","71","51713  >  12000 [PSH, ACK] Seq=1 Ack=1 Win=2619648 Len=27"
"154","110.544292","127.0.0.1","127.0.0.1","TCP","44","12000  >  51713 [ACK] Seq=1 Ack=28 Win=2619648 Len=0"
"155","110.544434","127.0.0.1","127.0.0.1","TCP","44","12000  >  51712 [FIN, ACK] Seq=4 Ack=17 Win=2619648 Len=0"
"156","110.544473","127.0.0.1","127.0.0.1","TCP","44","51712  >  12000 [ACK] Seq=17 Ack=5 Win=2619648 Len=0"
"157","110.545483","127.0.0.1","127.0.0.1","TCP","71","12000  >  51713 [PSH, ACK] Seq=1 Ack=28 Win=2619648 Len=27"
"158","110.545525","127.0.0.1","127.0.0.1","TCP","44","51713  >  12000 [ACK] Seq=28 Ack=28 Win=2619648 Len=0"
"159","110.546262","127.0.0.1","127.0.0.1","TCP","76","51713  >  12000 [PSH, ACK] Seq=28 Ack=28 Win=2619648 Len=32"
"160","110.546301","127.0.0.1","127.0.0.1","TCP","44","12000  >  51713 [ACK] Seq=28 Ack=60 Win=2619648 Len=0"
"161","110.546775","127.0.0.1","127.0.0.1","TCP","44","51713  >  12000 [FIN, ACK] Seq=60 Ack=28 Win=2619648 Len=0"
"162","110.546809","127.0.0.1","127.0.0.1","TCP","44","12000  >  51713 [ACK] Seq=28 Ack=61 Win=2619648 Len=0"
"163","120.623511","127.0.0.1","127.0.0.1","TCP","56","51714  >  12000 [SYN] Seq=0 Win=65535 Len=0 MSS=65495 WS=256 SACK_PERM=1"
"164","120.623605","127.0.0.1","127.0.0.1","TCP","56","12000  >  51714 [SYN, ACK] Seq=0 Ack=1 Win=65535 Len=0 MSS=65495 WS=256 SACK_PERM=1"
"165","120.623673","127.0.0.1","127.0.0.1","TCP","44","51714  >  12000 [ACK] Seq=1 Ack=1 Win=2619648 Len=0"
"166","120.623718","127.0.0.1","127.0.0.1","TCP","46","51714  >  12000 [PSH, ACK] Seq=1 Ack=1 Win=2619648 Len=2"
"167","120.623744","127.0.0.1","127.0.0.1","TCP","44","12000  >  51714 [ACK] Seq=1 Ack=3 Win=2619648 Len=0"
"168","120.623881","127.0.0.1","127.0.0.1","TCP","44","12000  >  51713 [FIN, ACK] Seq=28 Ack=61 Win=2619648 Len=0"
"169","120.623914","127.0.0.1","127.0.0.1","TCP","44","51713  >  12000 [ACK] Seq=61 Ack=29 Win=2619648 Len=0"
"170","120.624772","127.0.0.1","127.0.0.1","TCP","47","12000  >  51714 [PSH, ACK] Seq=1 Ack=3 Win=2619648 Len=3"
"171","120.624814","127.0.0.1","127.0.0.1","TCP","44","51714  >  12000 [ACK] Seq=3 Ack=4 Win=2619648 Len=0"
"172","120.625373","127.0.0.1","127.0.0.1","TCP","52","51714  >  12000 [PSH, ACK] Seq=3 Ack=4 Win=2619648 Len=8[Malformed Packet]"
"173","120.625413","127.0.0.1","127.0.0.1","TCP","44","12000  >  51714 [ACK] Seq=4 Ack=11 Win=2619648 Len=0"
"174","120.625962","127.0.0.1","127.0.0.1","TCP","44","51714  >  12000 [FIN, ACK] Seq=11 Ack=4 Win=2619648 Len=0"
"175","120.625999","127.0.0.1","127.0.0.1","TCP","44","12000  >  51714 [ACK] Seq=4 Ack=12 Win=2619648 Len=0"
"176","130.677793","127.0.0.1","127.0.0.1","TCP","56","51715  >  12000 [SYN] Seq=0 Win=65535 Len=0 MSS=65495 WS=256 SACK_PERM=1"
"177","130.677863","127.0.0.1","127.0.0.1","TCP","56","12000  >  51715 [SYN, ACK] Seq=0 Ack=1 Win=65535 Len=0 MSS=65495 WS=256 SACK_PERM=1"
"178","130.677908","127.0.0.1","127.0.0.1","TCP","44","51715  >  12000 [ACK] Seq=1 Ack=1 Win=2619648 Len=0"
"179","130.677947","127.0.0.1","127.0.0.1","TCP","60","51715  >  12000 [PSH, ACK] Seq=1 Ack=1 Win=2619648 Len=16"
"180","130.677968","127.0.0.1","127.0.0.1","TCP","44","12000  >  51715 [ACK] Seq=1 Ack=17 Win=2619648 Len=0"
"181","130.678167","127.0.0.1","127.0.0.1","TCP","44","12000  >  51714 [FIN, ACK] Seq=4 Ack=12 Win=2619648 Len=0"
"182","130.678210","127.0.0.1","127.0.0.1","TCP","44","51714  >  12000 [ACK] Seq=12 Ack=5 Win=2619648 Len=0"
"183","130.679583","127.0.0.1","127.0.0.1","TCP","60","12000  >  51715 [PSH, ACK] Seq=1 Ack=17 Win=2619648 Len=16"
"184","130.679625","127.0.0.1","127.0.0.1","TCP","44","51715  >  12000 [ACK] Seq=17 Ack=17 Win=2619648 Len=0"
"185","130.680386","127.0.0.1","127.0.0.1","TCP","65","51715  >  12000 [PSH, ACK] Seq=17 Ack=17 Win=2619648 Len=21"
"186","130.680427","127.0.0.1","127.0.0.1","TCP","44","12000  >  51715 [ACK] Seq=17 Ack=38 Win=2619648 Len=0"
"187","130.681050","127.0.0.1","127.0.0.1","TCP","44","51715  >  12000 [FIN, ACK] Seq=38 Ack=17 Win=2619648 Len=0"
"188","130.681088","127.0.0.1","127.0.0.1","TCP","44","12000  >  51715 [ACK] Seq=17 Ack=39 Win=2619648 Len=0"
"189","140.726668","127.0.0.1","127.0.0.1","TCP","56","51717  >  12000 [SYN] Seq=0 Win=65535 Len=0 MSS=65495 WS=256 SACK_PERM=1"
"190","140.726742","127.0.0.1","127.0.0.1","TCP","56","12000  >  51717 [SYN, ACK] Seq=0 Ack=1 Win=65535 Len=0 MSS=65495 WS=256 SACK_PERM=1"
"191","140.726787","127.0.0.1","127.0.0.1","TCP","44","51717  >  12000 [ACK] Seq=1 Ack=1 Win=2619648 Len=0"
"192","140.726825","127.0.0.1","127.0.0.1","TCP","52","51717  >  12000 [PSH, ACK] Seq=1 Ack=1 Win=2619648 Len=8"
"193","140.726846","127.0.0.1","127.0.0.1","TCP","44","12000  >  51717 [ACK] Seq=1 Ack=9 Win=2619648 Len=0"
"194","140.727025","127.0.0.1","127.0.0.1","TCP","44","12000  >  51715 [FIN, ACK] Seq=17 Ack=39 Win=2619648 Len=0"
"195","140.727066","127.0.0.1","127.0.0.1","TCP","44","51715  >  12000 [ACK] Seq=39 Ack=18 Win=2619648 Len=0"
"196","140.727947","127.0.0.1","127.0.0.1","TCP","47","12000  >  51717 [PSH, ACK] Seq=1 Ack=9 Win=2619648 Len=3"
"197","140.727986","127.0.0.1","127.0.0.1","TCP","44","51717  >  12000 [ACK] Seq=9 Ack=4 Win=2619648 Len=0"
"198","140.728605","127.0.0.1","127.0.0.1","TCP","52","51717  >  12000 [PSH, ACK] Seq=9 Ack=4 Win=2619648 Len=8[Malformed Packet]"
"199","140.728646","127.0.0.1","127.0.0.1","TCP","44","12000  >  51717 [ACK] Seq=4 Ack=17 Win=2619648 Len=0"
"200","140.729248","127.0.0.1","127.0.0.1","TCP","44","51717  >  12000 [FIN, ACK] Seq=17 Ack=4 Win=2619648 Len=0"
"201","140.729285","127.0.0.1","127.0.0.1","TCP","44","12000  >  51717 [ACK] Seq=4 Ack=18 Win=2619648 Len=0"
"202","150.789073","127.0.0.1","127.0.0.1","TCP","56","51719  >  12000 [SYN] Seq=0 Win=65535 Len=0 MSS=65495 WS=256 SACK_PERM=1"
"203","150.789167","127.0.0.1","127.0.0.1","TCP","56","12000  >  51719 [SYN, ACK] Seq=0 Ack=1 Win=65535 Len=0 MSS=65495 WS=256 SACK_PERM=1"
"204","150.789243","127.0.0.1","127.0.0.1","TCP","44","51719  >  12000 [ACK] Seq=1 Ack=1 Win=2619648 Len=0"
"205","150.789288","127.0.0.1","127.0.0.1","TCP","60","51719  >  12000 [PSH, ACK] Seq=1 Ack=1 Win=2619648 Len=16"
"206","150.789309","127.0.0.1","127.0.0.1","TCP","44","12000  >  51719 [ACK] Seq=1 Ack=17 Win=2619648 Len=0"
"207","150.789524","127.0.0.1","127.0.0.1","TCP","44","12000  >  51717 [FIN, ACK] Seq=4 Ack=18 Win=2619648 Len=0"
"208","150.789563","127.0.0.1","127.0.0.1","TCP","44","51717  >  12000 [ACK] Seq=18 Ack=5 Win=2619648 Len=0"
"209","150.790510","127.0.0.1","127.0.0.1","TCP","60","12000  >  51719 [PSH, ACK] Seq=1 Ack=17 Win=2619648 Len=16"
"210","150.790550","127.0.0.1","127.0.0.1","TCP","44","51719  >  12000 [ACK] Seq=17 Ack=17 Win=2619648 Len=0"
"211","150.791095","127.0.0.1","127.0.0.1","TCP","65","51719  >  12000 [PSH, ACK] Seq=17 Ack=17 Win=2619648 Len=21"
"212","150.791139","127.0.0.1","127.0.0.1","TCP","44","12000  >  51719 [ACK] Seq=17 Ack=38 Win=2619648 Len=0"
"213","150.791877","127.0.0.1","127.0.0.1","TCP","44","51719  >  12000 [FIN, ACK] Seq=38 Ack=17 Win=2619648 Len=0"
"214","150.791913","127.0.0.1","127.0.0.1","TCP","44","12000  >  51719 [ACK] Seq=17 Ack=39 Win=2619648 Len=0"
"215","160.847693","127.0.0.1","127.0.0.1","TCP","56","51720  >  12000 [SYN] Seq=0 Win=65535 Len=0 MSS=65495 WS=256 SACK_PERM=1"
"216","160.847790","127.0.0.1","127.0.0.1","TCP","56","12000  >  51720 [SYN, ACK] Seq=0 Ack=1 Win=65535 Len=0 MSS=65495 WS=256 SACK_PERM=1"
"217","160.847860","127.0.0.1","127.0.0.1","TCP","44","51720  >  12000 [ACK] Seq=1 Ack=1 Win=2619648 Len=0"
"218","160.847895","127.0.0.1","127.0.0.1","TCP","63","51720  >  12000 [PSH, ACK] Seq=1 Ack=1 Win=2619648 Len=19"
"219","160.847918","127.0.0.1","127.0.0.1","TCP","44","12000  >  51720 [ACK] Seq=1 Ack=20 Win=2619648 Len=0"
"220","160.848067","127.0.0.1","127.0.0.1","TCP","44","12000  >  51719 [FIN, ACK] Seq=17 Ack=39 Win=2619648 Len=0"
"221","160.848107","127.0.0.1","127.0.0.1","TCP","44","51719  >  12000 [ACK] Seq=39 Ack=18 Win=2619648 Len=0"
"222","160.849112","127.0.0.1","127.0.0.1","TCP","63","12000  >  51720 [PSH, ACK] Seq=1 Ack=20 Win=2619648 Len=19"
"223","160.849165","127.0.0.1","127.0.0.1","TCP","44","51720  >  12000 [ACK] Seq=20 Ack=20 Win=2619648 Len=0"
"224","160.849719","127.0.0.1","127.0.0.1","TCP","68","51720  >  12000 [PSH, ACK] Seq=20 Ack=20 Win=2619648 Len=24"
"225","160.849767","127.0.0.1","127.0.0.1","TCP","44","12000  >  51720 [ACK] Seq=20 Ack=44 Win=2619648 Len=0"
"226","160.850404","127.0.0.1","127.0.0.1","TCP","44","51720  >  12000 [FIN, ACK] Seq=44 Ack=20 Win=2619648 Len=0"
"227","160.850447","127.0.0.1","127.0.0.1","TCP","44","12000  >  51720 [ACK] Seq=20 Ack=45 Win=2619648 Len=0"
"228","170.924972","127.0.0.1","127.0.0.1","TCP","56","51721  >  12000 [SYN] Seq=0 Win=65535 Len=0 MSS=65495 WS=256 SACK_PERM=1"
"229","170.925067","127.0.0.1","127.0.0.1","TCP","56","12000  >  51721 [SYN, ACK] Seq=0 Ack=1 Win=65535 Len=0 MSS=65495 WS=256 SACK_PERM=1"
"230","170.925124","127.0.0.1","127.0.0.1","TCP","44","51721  >  12000 [ACK] Seq=1 Ack=1 Win=2619648 Len=0"
"231","170.925174","127.0.0.1","127.0.0.1","TCP","52","51721  >  12000 [PSH, ACK] Seq=1 Ack=1 Win=2619648 Len=8"
"232","170.925195","127.0.0.1","127.0.0.1","TCP","44","12000  >  51721 [ACK] Seq=1 Ack=9 Win=2619648 Len=0"
"233","170.925360","127.0.0.1","127.0.0.1","TCP","44","12000  >  51720 [FIN, ACK] Seq=20 Ack=45 Win=2619648 Len=0"
"234","170.925401","127.0.0.1","127.0.0.1","TCP","44","51720  >  12000 [ACK] Seq=45 Ack=21 Win=2619648 Len=0"
"235","170.926347","127.0.0.1","127.0.0.1","TCP","49","12000  >  51721 [PSH, ACK] Seq=1 Ack=9 Win=2619648 Len=5"
"236","170.926388","127.0.0.1","127.0.0.1","TCP","44","51721  >  12000 [ACK] Seq=9 Ack=6 Win=2619648 Len=0"
"237","170.926907","127.0.0.1","127.0.0.1","TCP","54","51721  >  12000 [PSH, ACK] Seq=9 Ack=6 Win=2619648 Len=10"
"238","170.926946","127.0.0.1","127.0.0.1","TCP","44","12000  >  51721 [ACK] Seq=6 Ack=19 Win=2619648 Len=0"
"239","170.927426","127.0.0.1","127.0.0.1","TCP","44","51721  >  12000 [FIN, ACK] Seq=19 Ack=6 Win=2619648 Len=0"
"240","170.927467","127.0.0.1","127.0.0.1","TCP","44","12000  >  51721 [ACK] Seq=6 Ack=20 Win=2619648 Len=0"
"241","181.011238","127.0.0.1","127.0.0.1","TCP","56","51723  >  12000 [SYN] Seq=0 Win=65535 Len=0 MSS=65495 WS=256 SACK_PERM=1"
"242","181.011310","127.0.0.1","127.0.0.1","TCP","56","12000  >  51723 [SYN, ACK] Seq=0 Ack=1 Win=65535 Len=0 MSS=65495 WS=256 SACK_PERM=1"
"243","181.011355","127.0.0.1","127.0.0.1","TCP","44","51723  >  12000 [ACK] Seq=1 Ack=1 Win=2619648 Len=0"
"244","181.011407","127.0.0.1","127.0.0.1","TCP","72","51723  >  12000 [PSH, ACK] Seq=1 Ack=1 Win=2619648 Len=28"
"245","181.011438","127.0.0.1","127.0.0.1","TCP","44","12000  >  51723 [ACK] Seq=1 Ack=29 Win=2619648 Len=0"
"246","181.011596","127.0.0.1","127.0.0.1","TCP","44","12000  >  51721 [FIN, ACK] Seq=6 Ack=20 Win=2619648 Len=0"
"247","181.011636","127.0.0.1","127.0.0.1","TCP","44","51721  >  12000 [ACK] Seq=20 Ack=7 Win=2619648 Len=0"
"248","181.012634","127.0.0.1","127.0.0.1","TCP","72","12000  >  51723 [PSH, ACK] Seq=1 Ack=29 Win=2619648 Len=28"
"249","181.012676","127.0.0.1","127.0.0.1","TCP","44","51723  >  12000 [ACK] Seq=29 Ack=29 Win=2619648 Len=0"
"250","181.013216","127.0.0.1","127.0.0.1","TCP","77","51723  >  12000 [PSH, ACK] Seq=29 Ack=29 Win=2619648 Len=33"
"251","181.013256","127.0.0.1","127.0.0.1","TCP","44","12000  >  51723 [ACK] Seq=29 Ack=62 Win=2619648 Len=0"
"252","181.014008","127.0.0.1","127.0.0.1","TCP","44","51723  >  12000 [FIN, ACK] Seq=62 Ack=29 Win=2619648 Len=0"
"253","181.014046","127.0.0.1","127.0.0.1","TCP","44","12000  >  51723 [ACK] Seq=29 Ack=63 Win=2619648 Len=0"
"254","191.064231","127.0.0.1","127.0.0.1","TCP","56","51724  >  12000 [SYN] Seq=0 Win=65535 Len=0 MSS=65495 WS=256 SACK_PERM=1"
"255","191.064277","127.0.0.1","127.0.0.1","TCP","56","12000  >  51724 [SYN, ACK] Seq=0 Ack=1 Win=65535 Len=0 MSS=65495 WS=256 SACK_PERM=1"
"256","191.064318","127.0.0.1","127.0.0.1","TCP","44","51724  >  12000 [ACK] Seq=1 Ack=1 Win=2619648 Len=0"
"257","191.064358","127.0.0.1","127.0.0.1","TCP","50","51724  >  12000 [PSH, ACK] Seq=1 Ack=1 Win=2619648 Len=6"
"258","191.064378","127.0.0.1","127.0.0.1","TCP","44","12000  >  51724 [ACK] Seq=1 Ack=7 Win=2619648 Len=0"
"259","191.064555","127.0.0.1","127.0.0.1","TCP","44","12000  >  51723 [FIN, ACK] Seq=29 Ack=63 Win=2619648 Len=0"
"260","191.064595","127.0.0.1","127.0.0.1","TCP","44","51723  >  12000 [ACK] Seq=63 Ack=30 Win=2619648 Len=0"
"261","191.065495","127.0.0.1","127.0.0.1","TCP","49","12000  >  51724 [PSH, ACK] Seq=1 Ack=7 Win=2619648 Len=5"
"262","191.065534","127.0.0.1","127.0.0.1","TCP","44","51724  >  12000 [ACK] Seq=7 Ack=6 Win=2619648 Len=0"
"263","191.066064","127.0.0.1","127.0.0.1","TCP","54","51724  >  12000 [PSH, ACK] Seq=7 Ack=6 Win=2619648 Len=10"
"264","191.066109","127.0.0.1","127.0.0.1","TCP","44","12000  >  51724 [ACK] Seq=6 Ack=17 Win=2619648 Len=0"
"265","191.066856","127.0.0.1","127.0.0.1","TCP","44","51724  >  12000 [FIN, ACK] Seq=17 Ack=6 Win=2619648 Len=0"
"266","191.066896","127.0.0.1","127.0.0.1","TCP","44","12000  >  51724 [ACK] Seq=6 Ack=18 Win=2619648 Len=0"
