"No.,""Time"",""Source"",""Destination"",""Protocol"",""Length"",""Info"""
"149,""31.630206"",""127.0.0.1"",""127.0.0.1"",""TCP"",""56"",""52642  >  12000 [SYN] Seq=0 Win=65535 Len=0 MSS=65495 WS=256 SACK_PERM=1"""
"150,""31.630422"",""127.0.0.1"",""127.0.0.1"",""TCP"",""56"",""12000  >  52642 [SYN, ACK] Seq=0 Ack=1 Win=65535 Len=0 MSS=65495 WS=256 SACK_PERM=1"""
"151,""31.630522"",""127.0.0.1"",""127.0.0.1"",""TCP"",""44"",""52642  >  12000 [ACK] Seq=1 Ack=1 Win=2619648 Len=0"""
"152,""31.633542"",""127.0.0.1"",""127.0.0.1"",""TCP"",""73"",""52642  >  12000 [PSH, ACK] Seq=1 Ack=1 Win=2619648 Len=29"""
"153,""31.633645"",""127.0.0.1"",""127.0.0.1"",""TCP"",""44"",""12000  >  52642 [ACK] Seq=1 Ack=30 Win=2619648 Len=0"""
"154,""31.636665"",""127.0.0.1"",""127.0.0.1"",""TCP"",""73"",""12000  >  52642 [PSH, ACK] Seq=1 Ack=30 Win=2619648 Len=29"""
"155,""31.636768"",""127.0.0.1"",""127.0.0.1"",""TCP"",""44"",""52642  >  12000 [ACK] Seq=30 Ack=30 Win=2619648 Len=0"""
"156,""31.640544"",""127.0.0.1"",""127.0.0.1"",""TCP"",""78"",""52642  >  12000 [PSH, ACK] Seq=30 Ack=30 Win=2619648 Len=34"""
"157,""31.640627"",""127.0.0.1"",""127.0.0.1"",""TCP"",""44"",""12000  >  52642 [ACK] Seq=30 Ack=64 Win=2619648 Len=0"""
"158,""31.642039"",""127.0.0.1"",""127.0.0.1"",""TCP"",""44"",""52642  >  12000 [FIN, ACK] Seq=64 Ack=30 Win=2619648 Len=0"""
"159,""31.642190"",""127.0.0.1"",""127.0.0.1"",""TCP"",""44"",""12000  >  52642 [ACK] Seq=30 Ack=65 Win=2619648 Len=0"""
"206,""41.734887"",""127.0.0.1"",""127.0.0.1"",""TCP"",""56"",""52648  >  12000 [SYN] Seq=0 Win=65535 Len=0 MSS=65495 WS=256 SACK_PERM=1"""
"207,""41.735039"",""127.0.0.1"",""127.0.0.1"",""TCP"",""56"",""12000  >  52648 [SYN, ACK] Seq=0 Ack=1 Win=65535 Len=0 MSS=65495 WS=256 SACK_PERM=1"""
"208,""41.735155"",""127.0.0.1"",""127.0.0.1"",""TCP"",""44"",""52648  >  12000 [ACK] Seq=1 Ack=1 Win=2619648 Len=0"""
"209,""41.735240"",""127.0.0.1"",""127.0.0.1"",""TCP"",""52"",""52648  >  12000 [PSH, ACK] Seq=1 Ack=1 Win=2619648 Len=8"""
"210,""41.735284"",""127.0.0.1"",""127.0.0.1"",""TCP"",""44"",""12000  >  52648 [ACK] Seq=1 Ack=9 Win=2619648 Len=0"""
"211,""41.735414"",""127.0.0.1"",""127.0.0.1"",""TCP"",""44"",""12000  >  52642 [FIN, ACK] Seq=30 Ack=65 Win=2619648 Len=0"""
"212,""41.735576"",""127.0.0.1"",""127.0.0.1"",""TCP"",""44"",""52642  >  12000 [ACK] Seq=65 Ack=31 Win=2619648 Len=0"""
"213,""41.737625"",""127.0.0.1"",""127.0.0.1"",""TCP"",""47"",""12000  >  52648 [PSH, ACK] Seq=1 Ack=9 Win=2619648 Len=3"""
"214,""41.737722"",""127.0.0.1"",""127.0.0.1"",""TCP"",""44"",""52648  >  12000 [ACK] Seq=9 Ack=4 Win=2619648 Len=0"""
"215,""41.739022"",""127.0.0.1"",""127.0.0.1"",""TCP"",""52"",""52648  >  12000 [PSH, ACK] Seq=9 Ack=4 Win=2619648 Len=8[Malformed Packet]"""
"216,""41.739104"",""127.0.0.1"",""127.0.0.1"",""TCP"",""44"",""12000  >  52648 [ACK] Seq=4 Ack=17 Win=2619648 Len=0"""
"217,""41.739829"",""127.0.0.1"",""127.0.0.1"",""TCP"",""44"",""52648  >  12000 [FIN, ACK] Seq=17 Ack=4 Win=2619648 Len=0"""
"218,""41.739903"",""127.0.0.1"",""127.0.0.1"",""TCP"",""44"",""12000  >  52648 [ACK] Seq=4 Ack=18 Win=2619648 Len=0"""
"267,""51.861306"",""127.0.0.1"",""127.0.0.1"",""TCP"",""56"",""52657  >  12000 [SYN] Seq=0 Win=65535 Len=0 MSS=65495 WS=256 SACK_PERM=1"""
"268,""51.861458"",""127.0.0.1"",""127.0.0.1"",""TCP"",""56"",""12000  >  52657 [SYN, ACK] Seq=0 Ack=1 Win=65535 Len=0 MSS=65495 WS=256 SACK_PERM=1"""
"269,""51.861571"",""127.0.0.1"",""127.0.0.1"",""TCP"",""44"",""52657  >  12000 [ACK] Seq=1 Ack=1 Win=2619648 Len=0"""
"270,""51.861654"",""127.0.0.1"",""127.0.0.1"",""TCP"",""69"",""52657  >  12000 [PSH, ACK] Seq=1 Ack=1 Win=2619648 Len=25"""
"271,""51.861695"",""127.0.0.1"",""127.0.0.1"",""TCP"",""44"",""12000  >  52657 [ACK] Seq=1 Ack=26 Win=2619648 Len=0"""
"272,""51.861829"",""127.0.0.1"",""127.0.0.1"",""TCP"",""44"",""12000  >  52648 [FIN, ACK] Seq=4 Ack=18 Win=2619648 Len=0"""
"273,""51.861994"",""127.0.0.1"",""127.0.0.1"",""TCP"",""44"",""52648  >  12000 [ACK] Seq=18 Ack=5 Win=2619648 Len=0"""
"274,""51.864086"",""127.0.0.1"",""127.0.0.1"",""TCP"",""69"",""12000  >  52657 [PSH, ACK] Seq=1 Ack=26 Win=2619648 Len=25"""
"275,""51.864210"",""127.0.0.1"",""127.0.0.1"",""TCP"",""44"",""52657  >  12000 [ACK] Seq=26 Ack=26 Win=2619648 Len=0"""
"276,""51.865604"",""127.0.0.1"",""127.0.0.1"",""TCP"",""74"",""52657  >  12000 [PSH, ACK] Seq=26 Ack=26 Win=2619648 Len=30"""
"277,""51.865695"",""127.0.0.1"",""127.0.0.1"",""TCP"",""44"",""12000  >  52657 [ACK] Seq=26 Ack=56 Win=2619648 Len=0"""
"278,""51.866316"",""127.0.0.1"",""127.0.0.1"",""TCP"",""44"",""52657  >  12000 [FIN, ACK] Seq=56 Ack=26 Win=2619648 Len=0"""
"279,""51.866394"",""127.0.0.1"",""127.0.0.1"",""TCP"",""44"",""12000  >  52657 [ACK] Seq=26 Ack=57 Win=2619648 Len=0"""
"328,""61.929450"",""127.0.0.1"",""127.0.0.1"",""TCP"",""56"",""52664  >  12000 [SYN] Seq=0 Win=65535 Len=0 MSS=65495 WS=256 SACK_PERM=1"""
"329,""61.929580"",""127.0.0.1"",""127.0.0.1"",""TCP"",""56"",""12000  >  52664 [SYN, ACK] Seq=0 Ack=1 Win=65535 Len=0 MSS=65495 WS=256 SACK_PERM=1"""
"330,""61.929696"",""127.0.0.1"",""127.0.0.1"",""TCP"",""44"",""52664  >  12000 [ACK] Seq=1 Ack=1 Win=2619648 Len=0"""
"331,""61.929844"",""127.0.0.1"",""127.0.0.1"",""TCP"",""54"",""52664  >  12000 [PSH, ACK] Seq=1 Ack=1 Win=2619648 Len=10"""
"332,""61.929917"",""127.0.0.1"",""127.0.0.1"",""TCP"",""44"",""12000  >  52664 [ACK] Seq=1 Ack=11 Win=2619648 Len=0"""
"333,""61.930203"",""127.0.0.1"",""127.0.0.1"",""TCP"",""44"",""12000  >  52657 [FIN, ACK] Seq=26 Ack=57 Win=2619648 Len=0"""
"334,""61.930432"",""127.0.0.1"",""127.0.0.1"",""TCP"",""44"",""52657  >  12000 [ACK] Seq=57 Ack=27 Win=2619648 Len=0"""
"335,""61.933244"",""127.0.0.1"",""127.0.0.1"",""TCP"",""54"",""12000  >  52664 [PSH, ACK] Seq=1 Ack=11 Win=2619648 Len=10"""
"336,""61.933337"",""127.0.0.1"",""127.0.0.1"",""TCP"",""44"",""52664  >  12000 [ACK] Seq=11 Ack=11 Win=2619648 Len=0"""
"337,""61.934967"",""127.0.0.1"",""127.0.0.1"",""TCP"",""59"",""52664  >  12000 [PSH, ACK] Seq=11 Ack=11 Win=2619648 Len=15"""
"338,""61.935052"",""127.0.0.1"",""127.0.0.1"",""TCP"",""44"",""12000  >  52664 [ACK] Seq=11 Ack=26 Win=2619648 Len=0"""
"339,""61.936348"",""127.0.0.1"",""127.0.0.1"",""TCP"",""44"",""52664  >  12000 [FIN, ACK] Seq=26 Ack=11 Win=2619648 Len=0"""
"340,""61.936429"",""127.0.0.1"",""127.0.0.1"",""TCP"",""44"",""12000  >  52664 [ACK] Seq=11 Ack=27 Win=2619648 Len=0"""
"388,""72.022992"",""127.0.0.1"",""127.0.0.1"",""TCP"",""56"",""52672  >  12000 [SYN] Seq=0 Win=65535 Len=0 MSS=65495 WS=256 SACK_PERM=1"""
"389,""72.023144"",""127.0.0.1"",""127.0.0.1"",""TCP"",""56"",""12000  >  52672 [SYN, ACK] Seq=0 Ack=1 Win=65535 Len=0 MSS=65495 WS=256 SACK_PERM=1"""
"390,""72.023260"",""127.0.0.1"",""127.0.0.1"",""TCP"",""44"",""52672  >  12000 [ACK] Seq=1 Ack=1 Win=2619648 Len=0"""
"391,""72.023342"",""127.0.0.1"",""127.0.0.1"",""TCP"",""66"",""52672  >  12000 [PSH, ACK] Seq=1 Ack=1 Win=2619648 Len=22"""
"392,""72.023381"",""127.0.0.1"",""127.0.0.1"",""TCP"",""44"",""12000  >  52672 [ACK] Seq=1 Ack=23 Win=2619648 Len=0"""
"393,""72.023526"",""127.0.0.1"",""127.0.0.1"",""TCP"",""44"",""12000  >  52664 [FIN, ACK] Seq=11 Ack=27 Win=2619648 Len=0"""
"394,""72.023712"",""127.0.0.1"",""127.0.0.1"",""TCP"",""44"",""52664  >  12000 [ACK] Seq=27 Ack=12 Win=2619648 Len=0"""
"395,""72.025899"",""127.0.0.1"",""127.0.0.1"",""TCP"",""66"",""12000  >  52672 [PSH, ACK] Seq=1 Ack=23 Win=2619648 Len=22"""
"396,""72.026027"",""127.0.0.1"",""127.0.0.1"",""TCP"",""44"",""52672  >  12000 [ACK] Seq=23 Ack=23 Win=2619648 Len=0"""
"397,""72.027218"",""127.0.0.1"",""127.0.0.1"",""TCP"",""71"",""52672  >  12000 [PSH, ACK] Seq=23 Ack=23 Win=2619648 Len=27"""
"398,""72.027298"",""127.0.0.1"",""127.0.0.1"",""TCP"",""44"",""12000  >  52672 [ACK] Seq=23 Ack=50 Win=2619648 Len=0"""
"399,""72.028081"",""127.0.0.1"",""127.0.0.1"",""TCP"",""44"",""52672  >  12000 [FIN, ACK] Seq=50 Ack=23 Win=2619648 Len=0"""
"400,""72.028149"",""127.0.0.1"",""127.0.0.1"",""TCP"",""44"",""12000  >  52672 [ACK] Seq=23 Ack=51 Win=2619648 Len=0"""
"458,""82.114798"",""127.0.0.1"",""127.0.0.1"",""TCP"",""56"",""52677  >  12000 [SYN] Seq=0 Win=65535 Len=0 MSS=65495 WS=256 SACK_PERM=1"""
"459,""82.115009"",""127.0.0.1"",""127.0.0.1"",""TCP"",""56"",""12000  >  52677 [SYN, ACK] Seq=0 Ack=1 Win=65535 Len=0 MSS=65495 WS=256 SACK_PERM=1"""
"460,""82.115140"",""127.0.0.1"",""127.0.0.1"",""TCP"",""44"",""52677  >  12000 [ACK] Seq=1 Ack=1 Win=2619648 Len=0"""
"461,""82.115479"",""127.0.0.1"",""127.0.0.1"",""TCP"",""71"",""52677  >  12000 [PSH, ACK] Seq=1 Ack=1 Win=2619648 Len=27"""
"462,""82.115570"",""127.0.0.1"",""127.0.0.1"",""TCP"",""44"",""12000  >  52677 [ACK] Seq=1 Ack=28 Win=2619648 Len=0"""
"463,""82.115660"",""127.0.0.1"",""127.0.0.1"",""TCP"",""44"",""12000  >  52672 [FIN, ACK] Seq=23 Ack=51 Win=2619648 Len=0"""
"464,""82.115883"",""127.0.0.1"",""127.0.0.1"",""TCP"",""44"",""52672  >  12000 [ACK] Seq=51 Ack=24 Win=2619648 Len=0"""
"465,""82.118524"",""127.0.0.1"",""127.0.0.1"",""TCP"",""71"",""12000  >  52677 [PSH, ACK] Seq=1 Ack=28 Win=2619648 Len=27"""
"466,""82.118614"",""127.0.0.1"",""127.0.0.1"",""TCP"",""44"",""52677  >  12000 [ACK] Seq=28 Ack=28 Win=2619648 Len=0"""
"467,""82.120054"",""127.0.0.1"",""127.0.0.1"",""TCP"",""76"",""52677  >  12000 [PSH, ACK] Seq=28 Ack=28 Win=2619648 Len=32"""
"468,""82.120180"",""127.0.0.1"",""127.0.0.1"",""TCP"",""44"",""12000  >  52677 [ACK] Seq=28 Ack=60 Win=2619648 Len=0"""
"469,""82.120821"",""127.0.0.1"",""127.0.0.1"",""TCP"",""44"",""52677  >  12000 [FIN, ACK] Seq=60 Ack=28 Win=2619648 Len=0"""
"470,""82.120895"",""127.0.0.1"",""127.0.0.1"",""TCP"",""44"",""12000  >  52677 [ACK] Seq=28 Ack=61 Win=2619648 Len=0"""
"523,""92.180605"",""127.0.0.1"",""127.0.0.1"",""TCP"",""56"",""52682  >  12000 [SYN] Seq=0 Win=65535 Len=0 MSS=65495 WS=256 SACK_PERM=1"""
"524,""92.180758"",""127.0.0.1"",""127.0.0.1"",""TCP"",""56"",""12000  >  52682 [SYN, ACK] Seq=0 Ack=1 Win=65535 Len=0 MSS=65495 WS=256 SACK_PERM=1"""
"525,""92.180873"",""127.0.0.1"",""127.0.0.1"",""TCP"",""44"",""52682  >  12000 [ACK] Seq=1 Ack=1 Win=2619648 Len=0"""
"526,""92.180955"",""127.0.0.1"",""127.0.0.1"",""TCP"",""46"",""52682  >  12000 [PSH, ACK] Seq=1 Ack=1 Win=2619648 Len=2"""
"527,""92.180994"",""127.0.0.1"",""127.0.0.1"",""TCP"",""44"",""12000  >  52682 [ACK] Seq=1 Ack=3 Win=2619648 Len=0"""
"528,""92.181125"",""127.0.0.1"",""127.0.0.1"",""TCP"",""44"",""12000  >  52677 [FIN, ACK] Seq=28 Ack=61 Win=2619648 Len=0"""
"529,""92.181307"",""127.0.0.1"",""127.0.0.1"",""TCP"",""44"",""52677  >  12000 [ACK] Seq=61 Ack=29 Win=2619648 Len=0"""
"530,""92.183663"",""127.0.0.1"",""127.0.0.1"",""TCP"",""49"",""12000  >  52682 [PSH, ACK] Seq=1 Ack=3 Win=2619648 Len=5"""
"531,""92.183761"",""127.0.0.1"",""127.0.0.1"",""TCP"",""44"",""52682  >  12000 [ACK] Seq=3 Ack=6 Win=2619648 Len=0"""
"532,""92.185129"",""127.0.0.1"",""127.0.0.1"",""TCP"",""54"",""52682  >  12000 [PSH, ACK] Seq=3 Ack=6 Win=2619648 Len=10"""
"533,""92.185211"",""127.0.0.1"",""127.0.0.1"",""TCP"",""44"",""12000  >  52682 [ACK] Seq=6 Ack=13 Win=2619648 Len=0"""
"534,""92.185891"",""127.0.0.1"",""127.0.0.1"",""TCP"",""44"",""52682  >  12000 [FIN, ACK] Seq=13 Ack=6 Win=2619648 Len=0"""
"535,""92.186002"",""127.0.0.1"",""127.0.0.1"",""TCP"",""44"",""12000  >  52682 [ACK] Seq=6 Ack=14 Win=2619648 Len=0"""
"586,""102.250424"",""127.0.0.1"",""127.0.0.1"",""TCP"",""56"",""52693  >  12000 [SYN] Seq=0 Win=65535 Len=0 MSS=65495 WS=256 SACK_PERM=1"""
"587,""102.250580"",""127.0.0.1"",""127.0.0.1"",""TCP"",""56"",""12000  >  52693 [SYN, ACK] Seq=0 Ack=1 Win=65535 Len=0 MSS=65495 WS=256 SACK_PERM=1"""
"588,""102.250692"",""127.0.0.1"",""127.0.0.1"",""TCP"",""44"",""52693  >  12000 [ACK] Seq=1 Ack=1 Win=2619648 Len=0"""
"589,""102.250774"",""127.0.0.1"",""127.0.0.1"",""TCP"",""73"",""52693  >  12000 [PSH, ACK] Seq=1 Ack=1 Win=2619648 Len=29"""
"590,""102.250821"",""127.0.0.1"",""127.0.0.1"",""TCP"",""44"",""12000  >  52693 [ACK] Seq=1 Ack=30 Win=2619648 Len=0"""
"591,""102.250949"",""127.0.0.1"",""127.0.0.1"",""TCP"",""44"",""12000  >  52682 [FIN, ACK] Seq=6 Ack=14 Win=2619648 Len=0"""
"592,""102.251117"",""127.0.0.1"",""127.0.0.1"",""TCP"",""44"",""52682  >  12000 [ACK] Seq=14 Ack=7 Win=2619648 Len=0"""
"593,""102.253248"",""127.0.0.1"",""127.0.0.1"",""TCP"",""73"",""12000  >  52693 [PSH, ACK] Seq=1 Ack=30 Win=2619648 Len=29"""
"594,""102.253340"",""127.0.0.1"",""127.0.0.1"",""TCP"",""44"",""52693  >  12000 [ACK] Seq=30 Ack=30 Win=2619648 Len=0"""
"595,""102.254784"",""127.0.0.1"",""127.0.0.1"",""TCP"",""78"",""52693  >  12000 [PSH, ACK] Seq=30 Ack=30 Win=2619648 Len=34"""
"596,""102.254884"",""127.0.0.1"",""127.0.0.1"",""TCP"",""44"",""12000  >  52693 [ACK] Seq=30 Ack=64 Win=2619648 Len=0"""
"597,""102.255543"",""127.0.0.1"",""127.0.0.1"",""TCP"",""44"",""52693  >  12000 [FIN, ACK] Seq=64 Ack=30 Win=2619648 Len=0"""
"598,""102.255650"",""127.0.0.1"",""127.0.0.1"",""TCP"",""44"",""12000  >  52693 [ACK] Seq=30 Ack=65 Win=2619648 Len=0"""
"643,""112.335848"",""127.0.0.1"",""127.0.0.1"",""TCP"",""56"",""52701  >  12000 [SYN] Seq=0 Win=65535 Len=0 MSS=65495 WS=256 SACK_PERM=1"""
"644,""112.336018"",""127.0.0.1"",""127.0.0.1"",""TCP"",""56"",""12000  >  52701 [SYN, ACK] Seq=0 Ack=1 Win=65535 Len=0 MSS=65495 WS=256 SACK_PERM=1"""
"645,""112.336117"",""127.0.0.1"",""127.0.0.1"",""TCP"",""44"",""52701  >  12000 [ACK] Seq=1 Ack=1 Win=2619648 Len=0"""
"646,""112.336207"",""127.0.0.1"",""127.0.0.1"",""TCP"",""62"",""52701  >  12000 [PSH, ACK] Seq=1 Ack=1 Win=2619648 Len=18"""
"647,""112.336266"",""127.0.0.1"",""127.0.0.1"",""TCP"",""44"",""12000  >  52701 [ACK] Seq=1 Ack=19 Win=2619648 Len=0"""
"648,""112.336426"",""127.0.0.1"",""127.0.0.1"",""TCP"",""44"",""12000  >  52693 [FIN, ACK] Seq=30 Ack=65 Win=2619648 Len=0"""
"649,""112.336651"",""127.0.0.1"",""127.0.0.1"",""TCP"",""44"",""52693  >  12000 [ACK] Seq=65 Ack=31 Win=2619648 Len=0"""
"650,""112.338659"",""127.0.0.1"",""127.0.0.1"",""TCP"",""62"",""12000  >  52701 [PSH, ACK] Seq=1 Ack=19 Win=2619648 Len=18"""
"651,""112.338754"",""127.0.0.1"",""127.0.0.1"",""TCP"",""44"",""52701  >  12000 [ACK] Seq=19 Ack=19 Win=2619648 Len=0"""
"652,""112.340045"",""127.0.0.1"",""127.0.0.1"",""TCP"",""67"",""52701  >  12000 [PSH, ACK] Seq=19 Ack=19 Win=2619648 Len=23"""
"653,""112.340126"",""127.0.0.1"",""127.0.0.1"",""TCP"",""44"",""12000  >  52701 [ACK] Seq=19 Ack=42 Win=2619648 Len=0"""
"654,""112.340721"",""127.0.0.1"",""127.0.0.1"",""TCP"",""44"",""52701  >  12000 [FIN, ACK] Seq=42 Ack=19 Win=2619648 Len=0"""
"655,""112.340784"",""127.0.0.1"",""127.0.0.1"",""TCP"",""44"",""12000  >  52701 [ACK] Seq=19 Ack=43 Win=2619648 Len=0"""
"702,""122.438833"",""127.0.0.1"",""127.0.0.1"",""TCP"",""56"",""52709  >  12000 [SYN] Seq=0 Win=65535 Len=0 MSS=65495 WS=256 SACK_PERM=1"""
"703,""122.439031"",""127.0.0.1"",""127.0.0.1"",""TCP"",""56"",""12000  >  52709 [SYN, ACK] Seq=0 Ack=1 Win=65535 Len=0 MSS=65495 WS=256 SACK_PERM=1"""
"704,""122.439159"",""127.0.0.1"",""127.0.0.1"",""TCP"",""44"",""52709  >  12000 [ACK] Seq=1 Ack=1 Win=2619648 Len=0"""
"705,""122.439296"",""127.0.0.1"",""127.0.0.1"",""TCP"",""51"",""52709  >  12000 [PSH, ACK] Seq=1 Ack=1 Win=2619648 Len=7"""
"706,""122.439376"",""127.0.0.1"",""127.0.0.1"",""TCP"",""44"",""12000  >  52709 [ACK] Seq=1 Ack=8 Win=2619648 Len=0"""
"707,""122.439715"",""127.0.0.1"",""127.0.0.1"",""TCP"",""44"",""12000  >  52701 [FIN, ACK] Seq=19 Ack=43 Win=2619648 Len=0"""
"708,""122.439949"",""127.0.0.1"",""127.0.0.1"",""TCP"",""44"",""52701  >  12000 [ACK] Seq=43 Ack=20 Win=2619648 Len=0"""
"709,""122.443410"",""127.0.0.1"",""127.0.0.1"",""TCP"",""47"",""12000  >  52709 [PSH, ACK] Seq=1 Ack=8 Win=2619648 Len=3"""
"710,""122.443500"",""127.0.0.1"",""127.0.0.1"",""TCP"",""44"",""52709  >  12000 [ACK] Seq=8 Ack=4 Win=2619648 Len=0"""
"711,""122.444890"",""127.0.0.1"",""127.0.0.1"",""TCP"",""52"",""52709  >  12000 [PSH, ACK] Seq=8 Ack=4 Win=2619648 Len=8[Malformed Packet]"""
"712,""122.444981"",""127.0.0.1"",""127.0.0.1"",""TCP"",""44"",""12000  >  52709 [ACK] Seq=4 Ack=16 Win=2619648 Len=0"""
"713,""122.445694"",""127.0.0.1"",""127.0.0.1"",""TCP"",""44"",""52709  >  12000 [FIN, ACK] Seq=16 Ack=4 Win=2619648 Len=0"""
"714,""122.445783"",""127.0.0.1"",""127.0.0.1"",""TCP"",""44"",""12000  >  52709 [ACK] Seq=4 Ack=17 Win=2619648 Len=0"""
"761,""132.538616"",""127.0.0.1"",""127.0.0.1"",""TCP"",""56"",""52718  >  12000 [SYN] Seq=0 Win=65535 Len=0 MSS=65495 WS=256 SACK_PERM=1"""
"762,""132.538814"",""127.0.0.1"",""127.0.0.1"",""TCP"",""56"",""12000  >  52718 [SYN, ACK] Seq=0 Ack=1 Win=65535 Len=0 MSS=65495 WS=256 SACK_PERM=1"""
"763,""132.538927"",""127.0.0.1"",""127.0.0.1"",""TCP"",""44"",""52718  >  12000 [ACK] Seq=1 Ack=1 Win=2619648 Len=0"""
"764,""132.539355"",""127.0.0.1"",""127.0.0.1"",""TCP"",""44"",""12000  >  52709 [FIN, ACK] Seq=4 Ack=17 Win=2619648 Len=0"""
"765,""132.539597"",""127.0.0.1"",""127.0.0.1"",""TCP"",""44"",""52709  >  12000 [ACK] Seq=17 Ack=5 Win=2619648 Len=0"""
"766,""132.540124"",""127.0.0.1"",""127.0.0.1"",""TCP"",""62"",""52718  >  12000 [PSH, ACK] Seq=1 Ack=1 Win=2619648 Len=18"""
"767,""132.540173"",""127.0.0.1"",""127.0.0.1"",""TCP"",""44"",""12000  >  52718 [ACK] Seq=1 Ack=19 Win=2619648 Len=0"""
"768,""132.542005"",""127.0.0.1"",""127.0.0.1"",""TCP"",""62"",""12000  >  52718 [PSH, ACK] Seq=1 Ack=19 Win=2619648 Len=18"""
"769,""132.542152"",""127.0.0.1"",""127.0.0.1"",""TCP"",""44"",""52718  >  12000 [ACK] Seq=19 Ack=19 Win=2619648 Len=0"""
"770,""132.543573"",""127.0.0.1"",""127.0.0.1"",""TCP"",""67"",""52718  >  12000 [PSH, ACK] Seq=19 Ack=19 Win=2619648 Len=23"""
"771,""132.543656"",""127.0.0.1"",""127.0.0.1"",""TCP"",""44"",""12000  >  52718 [ACK] Seq=19 Ack=42 Win=2619648 Len=0"""
"772,""132.544576"",""127.0.0.1"",""127.0.0.1"",""TCP"",""44"",""52718  >  12000 [FIN, ACK] Seq=42 Ack=19 Win=2619648 Len=0"""
"773,""132.544666"",""127.0.0.1"",""127.0.0.1"",""TCP"",""44"",""12000  >  52718 [ACK] Seq=19 Ack=43 Win=2619648 Len=0"""
"824,""142.638578"",""127.0.0.1"",""127.0.0.1"",""TCP"",""56"",""52728  >  12000 [SYN] Seq=0 Win=65535 Len=0 MSS=65495 WS=256 SACK_PERM=1"""
"825,""142.638760"",""127.0.0.1"",""127.0.0.1"",""TCP"",""56"",""12000  >  52728 [SYN, ACK] Seq=0 Ack=1 Win=65535 Len=0 MSS=65495 WS=256 SACK_PERM=1"""
"826,""142.638982"",""127.0.0.1"",""127.0.0.1"",""TCP"",""44"",""52728  >  12000 [ACK] Seq=1 Ack=1 Win=2619648 Len=0"""
"827,""142.639201"",""127.0.0.1"",""127.0.0.1"",""TCP"",""59"",""52728  >  12000 [PSH, ACK] Seq=1 Ack=1 Win=2619648 Len=15"""
"828,""142.639270"",""127.0.0.1"",""127.0.0.1"",""TCP"",""44"",""12000  >  52728 [ACK] Seq=1 Ack=16 Win=2619648 Len=0"""
"829,""142.639448"",""127.0.0.1"",""127.0.0.1"",""TCP"",""44"",""12000  >  52718 [FIN, ACK] Seq=19 Ack=43 Win=2619648 Len=0"""
"830,""142.639626"",""127.0.0.1"",""127.0.0.1"",""TCP"",""44"",""52718  >  12000 [ACK] Seq=43 Ack=20 Win=2619648 Len=0"""
"831,""142.643266"",""127.0.0.1"",""127.0.0.1"",""TCP"",""59"",""12000  >  52728 [PSH, ACK] Seq=1 Ack=16 Win=2619648 Len=15"""
"832,""142.643349"",""127.0.0.1"",""127.0.0.1"",""TCP"",""44"",""52728  >  12000 [ACK] Seq=16 Ack=16 Win=2619648 Len=0"""
"833,""142.644726"",""127.0.0.1"",""127.0.0.1"",""TCP"",""64"",""52728  >  12000 [PSH, ACK] Seq=16 Ack=16 Win=2619648 Len=20"""
"834,""142.644804"",""127.0.0.1"",""127.0.0.1"",""TCP"",""44"",""12000  >  52728 [ACK] Seq=16 Ack=36 Win=2619648 Len=0"""
"835,""142.645403"",""127.0.0.1"",""127.0.0.1"",""TCP"",""44"",""52728  >  12000 [FIN, ACK] Seq=36 Ack=16 Win=2619648 Len=0"""
"836,""142.645473"",""127.0.0.1"",""127.0.0.1"",""TCP"",""44"",""12000  >  52728 [ACK] Seq=16 Ack=37 Win=2619648 Len=0"""
"885,""152.690395"",""127.0.0.1"",""127.0.0.1"",""TCP"",""56"",""52735  >  12000 [SYN] Seq=0 Win=65535 Len=0 MSS=65495 WS=256 SACK_PERM=1"""
"886,""152.690543"",""127.0.0.1"",""127.0.0.1"",""TCP"",""56"",""12000  >  52735 [SYN, ACK] Seq=0 Ack=1 Win=65535 Len=0 MSS=65495 WS=256 SACK_PERM=1"""
"887,""152.690655"",""127.0.0.1"",""127.0.0.1"",""TCP"",""44"",""52735  >  12000 [ACK] Seq=1 Ack=1 Win=2619648 Len=0"""
"888,""152.690740"",""127.0.0.1"",""127.0.0.1"",""TCP"",""54"",""52735  >  12000 [PSH, ACK] Seq=1 Ack=1 Win=2619648 Len=10"""
"889,""152.690780"",""127.0.0.1"",""127.0.0.1"",""TCP"",""44"",""12000  >  52735 [ACK] Seq=1 Ack=11 Win=2619648 Len=0"""
"890,""152.690905"",""127.0.0.1"",""127.0.0.1"",""TCP"",""44"",""12000  >  52728 [FIN, ACK] Seq=16 Ack=37 Win=2619648 Len=0"""
"891,""152.691070"",""127.0.0.1"",""127.0.0.1"",""TCP"",""44"",""52728  >  12000 [ACK] Seq=37 Ack=17 Win=2619648 Len=0"""
"892,""152.693104"",""127.0.0.1"",""127.0.0.1"",""TCP"",""54"",""12000  >  52735 [PSH, ACK] Seq=1 Ack=11 Win=2619648 Len=10"""
"893,""152.693196"",""127.0.0.1"",""127.0.0.1"",""TCP"",""44"",""52735  >  12000 [ACK] Seq=11 Ack=11 Win=2619648 Len=0"""
"894,""152.694590"",""127.0.0.1"",""127.0.0.1"",""TCP"",""59"",""52735  >  12000 [PSH, ACK] Seq=11 Ack=11 Win=2619648 Len=15"""
"895,""152.694675"",""127.0.0.1"",""127.0.0.1"",""TCP"",""44"",""12000  >  52735 [ACK] Seq=11 Ack=26 Win=2619648 Len=0"""
"896,""152.695492"",""127.0.0.1"",""127.0.0.1"",""TCP"",""44"",""52735  >  12000 [FIN, ACK] Seq=26 Ack=11 Win=2619648 Len=0"""
"897,""152.695564"",""127.0.0.1"",""127.0.0.1"",""TCP"",""44"",""12000  >  52735 [ACK] Seq=11 Ack=27 Win=2619648 Len=0"""
"944,""162.755610"",""127.0.0.1"",""127.0.0.1"",""TCP"",""56"",""52746  >  12000 [SYN] Seq=0 Win=65535 Len=0 MSS=65495 WS=256 SACK_PERM=1"""
"945,""162.755812"",""127.0.0.1"",""127.0.0.1"",""TCP"",""56"",""12000  >  52746 [SYN, ACK] Seq=0 Ack=1 Win=65535 Len=0 MSS=65495 WS=256 SACK_PERM=1"""
"946,""162.755948"",""127.0.0.1"",""127.0.0.1"",""TCP"",""44"",""52746  >  12000 [ACK] Seq=1 Ack=1 Win=2619648 Len=0"""
"947,""162.756052"",""127.0.0.1"",""127.0.0.1"",""TCP"",""66"",""52746  >  12000 [PSH, ACK] Seq=1 Ack=1 Win=2619648 Len=22"""
"948,""162.756112"",""127.0.0.1"",""127.0.0.1"",""TCP"",""44"",""12000  >  52746 [ACK] Seq=1 Ack=23 Win=2619648 Len=0"""
"949,""162.756739"",""127.0.0.1"",""127.0.0.1"",""TCP"",""44"",""12000  >  52735 [FIN, ACK] Seq=11 Ack=27 Win=2619648 Len=0"""
"950,""162.756963"",""127.0.0.1"",""127.0.0.1"",""TCP"",""44"",""52735  >  12000 [ACK] Seq=27 Ack=12 Win=2619648 Len=0"""
"951,""162.760706"",""127.0.0.1"",""127.0.0.1"",""TCP"",""66"",""12000  >  52746 [PSH, ACK] Seq=1 Ack=23 Win=2619648 Len=22"""
"952,""162.760803"",""127.0.0.1"",""127.0.0.1"",""TCP"",""44"",""52746  >  12000 [ACK] Seq=23 Ack=23 Win=2619648 Len=0"""
"953,""162.762264"",""127.0.0.1"",""127.0.0.1"",""TCP"",""71"",""52746  >  12000 [PSH, ACK] Seq=23 Ack=23 Win=2619648 Len=27"""
"954,""162.762351"",""127.0.0.1"",""127.0.0.1"",""TCP"",""44"",""12000  >  52746 [ACK] Seq=23 Ack=50 Win=2619648 Len=0"""
"955,""162.763199"",""127.0.0.1"",""127.0.0.1"",""TCP"",""44"",""52746  >  12000 [FIN, ACK] Seq=50 Ack=23 Win=2619648 Len=0"""
"956,""162.763281"",""127.0.0.1"",""127.0.0.1"",""TCP"",""44"",""12000  >  52746 [ACK] Seq=23 Ack=51 Win=2619648 Len=0"""
"1013,""172.840157"",""127.0.0.1"",""127.0.0.1"",""TCP"",""56"",""52762  >  12000 [SYN] Seq=0 Win=65535 Len=0 MSS=65495 WS=256 SACK_PERM=1"""
"1014,""172.840366"",""127.0.0.1"",""127.0.0.1"",""TCP"",""56"",""12000  >  52762 [SYN, ACK] Seq=0 Ack=1 Win=65535 Len=0 MSS=65495 WS=256 SACK_PERM=1"""
"1015,""172.840485"",""127.0.0.1"",""127.0.0.1"",""TCP"",""44"",""52762  >  12000 [ACK] Seq=1 Ack=1 Win=2619648 Len=0"""
"1016,""172.840599"",""127.0.0.1"",""127.0.0.1"",""TCP"",""55"",""52762  >  12000 [PSH, ACK] Seq=1 Ack=1 Win=2619648 Len=11"""
"1017,""172.840655"",""127.0.0.1"",""127.0.0.1"",""TCP"",""44"",""12000  >  52762 [ACK] Seq=1 Ack=12 Win=2619648 Len=0"""
"1018,""172.840813"",""127.0.0.1"",""127.0.0.1"",""TCP"",""44"",""12000  >  52746 [FIN, ACK] Seq=23 Ack=51 Win=2619648 Len=0"""
"1019,""172.841014"",""127.0.0.1"",""127.0.0.1"",""TCP"",""44"",""52746  >  12000 [ACK] Seq=51 Ack=24 Win=2619648 Len=0"""
"1020,""172.843623"",""127.0.0.1"",""127.0.0.1"",""TCP"",""55"",""12000  >  52762 [PSH, ACK] Seq=1 Ack=12 Win=2619648 Len=11"""
"1021,""172.843714"",""127.0.0.1"",""127.0.0.1"",""TCP"",""44"",""52762  >  12000 [ACK] Seq=12 Ack=12 Win=2619648 Len=0"""
"1022,""172.845620"",""127.0.0.1"",""127.0.0.1"",""TCP"",""60"",""52762  >  12000 [PSH, ACK] Seq=12 Ack=12 Win=2619648 Len=16"""
"1023,""172.845704"",""127.0.0.1"",""127.0.0.1"",""TCP"",""44"",""12000  >  52762 [ACK] Seq=12 Ack=28 Win=2619648 Len=0"""
"1024,""172.846459"",""127.0.0.1"",""127.0.0.1"",""TCP"",""44"",""52762  >  12000 [FIN, ACK] Seq=28 Ack=12 Win=2619648 Len=0"""
"1025,""172.846540"",""127.0.0.1"",""127.0.0.1"",""TCP"",""44"",""12000  >  52762 [ACK] Seq=12 Ack=29 Win=2619648 Len=0"""
"1075,""182.935182"",""127.0.0.1"",""127.0.0.1"",""TCP"",""56"",""52767  >  12000 [SYN] Seq=0 Win=65535 Len=0 MSS=65495 WS=256 SACK_PERM=1"""
"1076,""182.935344"",""127.0.0.1"",""127.0.0.1"",""TCP"",""56"",""12000  >  52767 [SYN, ACK] Seq=0 Ack=1 Win=65535 Len=0 MSS=65495 WS=256 SACK_PERM=1"""
"1077,""182.935459"",""127.0.0.1"",""127.0.0.1"",""TCP"",""44"",""52767  >  12000 [ACK] Seq=1 Ack=1 Win=2619648 Len=0"""
"1078,""182.935544"",""127.0.0.1"",""127.0.0.1"",""TCP"",""46"",""52767  >  12000 [PSH, ACK] Seq=1 Ack=1 Win=2619648 Len=2"""
"1079,""182.935584"",""127.0.0.1"",""127.0.0.1"",""TCP"",""44"",""12000  >  52767 [ACK] Seq=1 Ack=3 Win=2619648 Len=0"""
"1080,""182.935721"",""127.0.0.1"",""127.0.0.1"",""TCP"",""44"",""12000  >  52762 [FIN, ACK] Seq=12 Ack=29 Win=2619648 Len=0"""
"1081,""182.935917"",""127.0.0.1"",""127.0.0.1"",""TCP"",""44"",""52762  >  12000 [ACK] Seq=29 Ack=13 Win=2619648 Len=0"""
"1082,""182.938022"",""127.0.0.1"",""127.0.0.1"",""TCP"",""47"",""12000  >  52767 [PSH, ACK] Seq=1 Ack=3 Win=2619648 Len=3"""
"1083,""182.938104"",""127.0.0.1"",""127.0.0.1"",""TCP"",""44"",""52767  >  12000 [ACK] Seq=3 Ack=4 Win=2619648 Len=0"""
"1084,""182.939478"",""127.0.0.1"",""127.0.0.1"",""TCP"",""52"",""52767  >  12000 [PSH, ACK] Seq=3 Ack=4 Win=2619648 Len=8[Malformed Packet]"""
"1085,""182.939557"",""127.0.0.1"",""127.0.0.1"",""TCP"",""44"",""12000  >  52767 [ACK] Seq=4 Ack=11 Win=2619648 Len=0"""
"1086,""182.940214"",""127.0.0.1"",""127.0.0.1"",""TCP"",""44"",""52767  >  12000 [FIN, ACK] Seq=11 Ack=4 Win=2619648 Len=0"""
"1087,""182.940295"",""127.0.0.1"",""127.0.0.1"",""TCP"",""44"",""12000  >  52767 [ACK] Seq=4 Ack=12 Win=2619648 Len=0"""
"1147,""192.999567"",""127.0.0.1"",""127.0.0.1"",""TCP"",""56"",""52774  >  12000 [SYN] Seq=0 Win=65535 Len=0 MSS=65495 WS=256 SACK_PERM=1"""
"1148,""192.999722"",""127.0.0.1"",""127.0.0.1"",""TCP"",""56"",""12000  >  52774 [SYN, ACK] Seq=0 Ack=1 Win=65535 Len=0 MSS=65495 WS=256 SACK_PERM=1"""
"1149,""192.999835"",""127.0.0.1"",""127.0.0.1"",""TCP"",""44"",""52774  >  12000 [ACK] Seq=1 Ack=1 Win=2619648 Len=0"""
"1150,""192.999921"",""127.0.0.1"",""127.0.0.1"",""TCP"",""63"",""52774  >  12000 [PSH, ACK] Seq=1 Ack=1 Win=2619648 Len=19"""
"1151,""192.999960"",""127.0.0.1"",""127.0.0.1"",""TCP"",""44"",""12000  >  52774 [ACK] Seq=1 Ack=20 Win=2619648 Len=0"""
"1152,""193.000121"",""127.0.0.1"",""127.0.0.1"",""TCP"",""44"",""12000  >  52767 [FIN, ACK] Seq=4 Ack=12 Win=2619648 Len=0"""
"1153,""193.000301"",""127.0.0.1"",""127.0.0.1"",""TCP"",""44"",""52767  >  12000 [ACK] Seq=12 Ack=5 Win=2619648 Len=0"""
"1154,""193.002372"",""127.0.0.1"",""127.0.0.1"",""TCP"",""63"",""12000  >  52774 [PSH, ACK] Seq=1 Ack=20 Win=2619648 Len=19"""
"1155,""193.002464"",""127.0.0.1"",""127.0.0.1"",""TCP"",""44"",""52774  >  12000 [ACK] Seq=20 Ack=20 Win=2619648 Len=0"""
"1156,""193.003628"",""127.0.0.1"",""127.0.0.1"",""TCP"",""68"",""52774  >  12000 [PSH, ACK] Seq=20 Ack=20 Win=2619648 Len=24"""
"1157,""193.003706"",""127.0.0.1"",""127.0.0.1"",""TCP"",""44"",""12000  >  52774 [ACK] Seq=20 Ack=44 Win=2619648 Len=0"""
"1158,""193.004507"",""127.0.0.1"",""127.0.0.1"",""TCP"",""44"",""52774  >  12000 [FIN, ACK] Seq=44 Ack=20 Win=2619648 Len=0"""
"1159,""193.004577"",""127.0.0.1"",""127.0.0.1"",""TCP"",""44"",""12000  >  52774 [ACK] Seq=20 Ack=45 Win=2619648 Len=0"""
"1204,""203.083802"",""127.0.0.1"",""127.0.0.1"",""TCP"",""56"",""52779  >  12000 [SYN] Seq=0 Win=65535 Len=0 MSS=65495 WS=256 SACK_PERM=1"""
"1205,""203.083954"",""127.0.0.1"",""127.0.0.1"",""TCP"",""56"",""12000  >  52779 [SYN, ACK] Seq=0 Ack=1 Win=65535 Len=0 MSS=65495 WS=256 SACK_PERM=1"""
"1206,""203.084064"",""127.0.0.1"",""127.0.0.1"",""TCP"",""44"",""52779  >  12000 [ACK] Seq=1 Ack=1 Win=2619648 Len=0"""
"1207,""203.084148"",""127.0.0.1"",""127.0.0.1"",""TCP"",""66"",""52779  >  12000 [PSH, ACK] Seq=1 Ack=1 Win=2619648 Len=22"""
"1208,""203.084189"",""127.0.0.1"",""127.0.0.1"",""TCP"",""44"",""12000  >  52779 [ACK] Seq=1 Ack=23 Win=2619648 Len=0"""
"1209,""203.084320"",""127.0.0.1"",""127.0.0.1"",""TCP"",""44"",""12000  >  52774 [FIN, ACK] Seq=20 Ack=45 Win=2619648 Len=0"""
"1210,""203.084492"",""127.0.0.1"",""127.0.0.1"",""TCP"",""44"",""52774  >  12000 [ACK] Seq=45 Ack=21 Win=2619648 Len=0"""
"1211,""203.086538"",""127.0.0.1"",""127.0.0.1"",""TCP"",""66"",""12000  >  52779 [PSH, ACK] Seq=1 Ack=23 Win=2619648 Len=22"""
"1212,""203.086633"",""127.0.0.1"",""127.0.0.1"",""TCP"",""44"",""52779  >  12000 [ACK] Seq=23 Ack=23 Win=2619648 Len=0"""
"1213,""203.088036"",""127.0.0.1"",""127.0.0.1"",""TCP"",""71"",""52779  >  12000 [PSH, ACK] Seq=23 Ack=23 Win=2619648 Len=27"""
"1214,""203.088122"",""127.0.0.1"",""127.0.0.1"",""TCP"",""44"",""12000  >  52779 [ACK] Seq=23 Ack=50 Win=2619648 Len=0"""
"1215,""203.088760"",""127.0.0.1"",""127.0.0.1"",""TCP"",""44"",""52779  >  12000 [FIN, ACK] Seq=50 Ack=23 Win=2619648 Len=0"""
"1216,""203.088831"",""127.0.0.1"",""127.0.0.1"",""TCP"",""44"",""12000  >  52779 [ACK] Seq=23 Ack=51 Win=2619648 Len=0"""
"1265,""213.173151"",""127.0.0.1"",""127.0.0.1"",""TCP"",""56"",""52785  >  12000 [SYN] Seq=0 Win=65535 Len=0 MSS=65495 WS=256 SACK_PERM=1"""
"1266,""213.173302"",""127.0.0.1"",""127.0.0.1"",""TCP"",""56"",""12000  >  52785 [SYN, ACK] Seq=0 Ack=1 Win=65535 Len=0 MSS=65495 WS=256 SACK_PERM=1"""
"1267,""213.173416"",""127.0.0.1"",""127.0.0.1"",""TCP"",""44"",""52785  >  12000 [ACK] Seq=1 Ack=1 Win=2619648 Len=0"""
"1268,""213.173503"",""127.0.0.1"",""127.0.0.1"",""TCP"",""71"",""52785  >  12000 [PSH, ACK] Seq=1 Ack=1 Win=2619648 Len=27"""
"1269,""213.173543"",""127.0.0.1"",""127.0.0.1"",""TCP"",""44"",""12000  >  52785 [ACK] Seq=1 Ack=28 Win=2619648 Len=0"""
"1270,""213.173700"",""127.0.0.1"",""127.0.0.1"",""TCP"",""44"",""12000  >  52779 [FIN, ACK] Seq=23 Ack=51 Win=2619648 Len=0"""
"1271,""213.173867"",""127.0.0.1"",""127.0.0.1"",""TCP"",""44"",""52779  >  12000 [ACK] Seq=51 Ack=24 Win=2619648 Len=0"""
"1272,""213.175970"",""127.0.0.1"",""127.0.0.1"",""TCP"",""71"",""12000  >  52785 [PSH, ACK] Seq=1 Ack=28 Win=2619648 Len=27"""
"1273,""213.176060"",""127.0.0.1"",""127.0.0.1"",""TCP"",""44"",""52785  >  12000 [ACK] Seq=28 Ack=28 Win=2619648 Len=0"""
"1274,""213.177505"",""127.0.0.1"",""127.0.0.1"",""TCP"",""76"",""52785  >  12000 [PSH, ACK] Seq=28 Ack=28 Win=2619648 Len=32"""
"1275,""213.177617"",""127.0.0.1"",""127.0.0.1"",""TCP"",""44"",""12000  >  52785 [ACK] Seq=28 Ack=60 Win=2619648 Len=0"""
"1276,""213.178415"",""127.0.0.1"",""127.0.0.1"",""TCP"",""44"",""52785  >  12000 [FIN, ACK] Seq=60 Ack=28 Win=2619648 Len=0"""
"1277,""213.178484"",""127.0.0.1"",""127.0.0.1"",""TCP"",""44"",""12000  >  52785 [ACK] Seq=28 Ack=61 Win=2619648 Len=0"""
"1322,""223.264077"",""127.0.0.1"",""127.0.0.1"",""TCP"",""56"",""52790  >  12000 [SYN] Seq=0 Win=65535 Len=0 MSS=65495 WS=256 SACK_PERM=1"""
"1323,""223.264230"",""127.0.0.1"",""127.0.0.1"",""TCP"",""56"",""12000  >  52790 [SYN, ACK] Seq=0 Ack=1 Win=65535 Len=0 MSS=65495 WS=256 SACK_PERM=1"""
"1324,""223.264346"",""127.0.0.1"",""127.0.0.1"",""TCP"",""44"",""52790  >  12000 [ACK] Seq=1 Ack=1 Win=2619648 Len=0"""
"1325,""223.264497"",""127.0.0.1"",""127.0.0.1"",""TCP"",""68"",""52790  >  12000 [PSH, ACK] Seq=1 Ack=1 Win=2619648 Len=24"""
"1326,""223.264540"",""127.0.0.1"",""127.0.0.1"",""TCP"",""44"",""12000  >  52790 [ACK] Seq=1 Ack=25 Win=2619648 Len=0"""
"1327,""223.264601"",""127.0.0.1"",""127.0.0.1"",""TCP"",""44"",""12000  >  52785 [FIN, ACK] Seq=28 Ack=61 Win=2619648 Len=0"""
"1328,""223.264770"",""127.0.0.1"",""127.0.0.1"",""TCP"",""44"",""52785  >  12000 [ACK] Seq=61 Ack=29 Win=2619648 Len=0"""
"1329,""223.266861"",""127.0.0.1"",""127.0.0.1"",""TCP"",""68"",""12000  >  52790 [PSH, ACK] Seq=1 Ack=25 Win=2619648 Len=24"""
"1330,""223.266951"",""127.0.0.1"",""127.0.0.1"",""TCP"",""44"",""52790  >  12000 [ACK] Seq=25 Ack=25 Win=2619648 Len=0"""
"1331,""223.268260"",""127.0.0.1"",""127.0.0.1"",""TCP"",""73"",""52790  >  12000 [PSH, ACK] Seq=25 Ack=25 Win=2619648 Len=29"""
"1332,""223.268336"",""127.0.0.1"",""127.0.0.1"",""TCP"",""44"",""12000  >  52790 [ACK] Seq=25 Ack=54 Win=2619648 Len=0"""
"1333,""223.269084"",""127.0.0.1"",""127.0.0.1"",""TCP"",""44"",""52790  >  12000 [FIN, ACK] Seq=54 Ack=25 Win=2619648 Len=0"""
"1334,""223.269182"",""127.0.0.1"",""127.0.0.1"",""TCP"",""44"",""12000  >  52790 [ACK] Seq=25 Ack=55 Win=2619648 Len=0"""
